{"artifact_schema_digest":"1c6537c2e580a8f554eb5623951564c362bdf7734ad98c88be29798c4f8190b1","config_digest":"969a42f6e262aca18e8acf05ece0a6a817e5e942fb244f3c903e9c29f405e3d3","data_digest_block_reason":"hermetic synthetic scenario; real market data digest deferred (G3/real-data stage)","data_digest_status":"blocked","engine_commit":"bcdc85df42439d38fb421e4c4197502c8c48d304","engine_semantics_version":"0.4.0-next_open_basket","input_data_digest":null,"oracle_source_digest":"7f662b42ad18f9be855e4796c313b348c55527fc456c3e6c6fae6501e37b6fbe","provenance_ref":"tests/strategy_references/reference_provenance.json","schema_version":"1.0","spec_digest":"5442a355deede80f3f18be5934ba6627938406c26e61fa97edb03b16311c781e","strategy_id":"etf_regression_rotation_v1"}